{
  "division": "Dillo #MAJORVER#.#MINORVER#",
  "versions": ["0.6", "0.7", "0.8", "2.0", "2.1", "3.0"],
  "sortIndex": 2330,
  "lite": false,
  "userAgents": [
    {
      "userAgent": "Dillo #MAJORVER#.#MINORVER#",
      "platform": "Linux",
      "properties": {
        "Parent": "DefaultProperties",
        "Comment": "Dillo #MAJORVER#.#MINORVER#",
        "Browser": "Dillo",
        "Browser_Type": "Browser",
        "Browser_Maker": "the Dillo Project",
        "Version": "#MAJORVER#.#MINORVER#",
        "MajorVer": "#MAJORVER#",
        "MinorVer": "#MINORVER#",
        "Frames": "true",
        "IFrames": "true",
        "Tables": "true",
        "Cookies": "true",
        "JavaScript": "true",
        "CssVersion": "2",
        "Device_Name": "PC",
        "Device_Maker": "Various",
        "Device_Type": "Desktop",
        "Device_Pointing_Method": "mouse"
      },
      "children": [
        {
          "match": "Dillo\/#MAJORVER#.#MINORVER#*"
        },
        {
          "match": "Mozilla\/5.0 (compatible; X11; Dillo\/#MAJORVER#.#MINORVER#*)"
        }
      ]
    }
  ]
}
