{
  "division": "Electron #MAJORVER#.#MINORVER#",
  "versions": [2, "1.8", "1.7", "1.6", "1.4", "1.3", "1.2"],
  "sortIndex": 2220,
  "lite": false,
  "standard": true,
  "userAgents": [
    {
      "userAgent": "Electron #MAJORVER#.#MINORVER#",
      "browser": "electron",
      "engine": "Blink",
      "device": "Windows Desktop",
      "properties": {
        "Parent": "DefaultProperties",
        "Comment": "Electron #MAJORVER#.#MINORVER#",
        "Version": "#MAJORVER#.#MINORVER#"
      },
      "children": [
        {
          "match": "Mozilla/5.0 (#PLATFORM#) applewebkit* (*khtml*like*gecko*) * Chrome/* Electron/#MAJORVER#.#MINORVER#* Safari/*",
          "device": "Macintosh",
          "platforms": [
            "OSX_10_13", "OSX_10_12",
            "OSX_10_11", "OSX_10_10", "OSX_10_9",
            "OSX"
          ]
        },
        {
          "match": "Mozilla/5.0 (#PLATFORM#) applewebkit* (*khtml*like*gecko*) Chrome/* Electron/#MAJORVER#.#MINORVER#* Safari/*",
          "device": "Macintosh",
          "platforms": [
            "OSX_10_13", "OSX_10_12",
            "OSX_10_11", "OSX_10_10", "OSX_10_9",
            "OSX"
          ]
        },
        {
          "match": "Mozilla/5.0 (#PLATFORM#) applewebkit* (*khtml*like*gecko*) * Chrome/* Electron/#MAJORVER#.#MINORVER#* Safari/*",
          "device": "Windows Desktop",
          "platforms": [
            "Win10_x64_B", "Win10_64_B", "Win10_32_B",
            "Win10_x64", "Win10_64", "Win10_32",
            "Win8_1_x64", "Win8_1_64", "Win8_1_32",
            "Win8_x64", "Win8_64", "Win8_32",
            "Win7_x64", "Win7_64", "Win7_32",
            "Windows"
          ]
        },
        {
          "match": "Mozilla/5.0 (#PLATFORM#) applewebkit* (*khtml*like*gecko*) Chrome/* Electron/#MAJORVER#.#MINORVER#* Safari/*",
          "device": "Windows Desktop",
          "platforms": [
            "Win10_x64_B", "Win10_64_B", "Win10_32_B",
            "Win10_x64", "Win10_64", "Win10_32",
            "Win8_1_x64", "Win8_1_64", "Win8_1_32",
            "Win8_x64", "Win8_64", "Win8_32",
            "Win7_x64", "Win7_64", "Win7_32",
            "Windows"
          ]
        },
        {
          "match": "Mozilla/5.0 (#PLATFORM#) applewebkit* (*khtml*like*gecko*) * Chrome/* Electron/#MAJORVER#.#MINORVER#* Safari/*",
          "device": "Linux Desktop",
          "platforms": [
            "Linux_64", "Linux"
          ]
        },
        {
          "match": "Mozilla/5.0 (#PLATFORM#) applewebkit* (*khtml*like*gecko*) Chrome/* Electron/#MAJORVER#.#MINORVER#* Safari/*",
          "device": "Linux Desktop",
          "platforms": [
            "Linux_64", "Linux"
          ]
        }
      ]
    }
  ]
}
