{
  "division": "adidxbot",
  "sortIndex": 1231,
  "lite": false,
  "standard": true,
  "userAgents": [
    {
      "userAgent": "adidxbot",
      "properties": {
        "Parent": "DefaultProperties",
        "Browser_Type": "Bot/Crawler",
        "Browser_Maker": "Microsoft Corporation",
        "Comment": "MSN",
        "Browser": "adidxbot",
        "Crawler": "true"
      },
      "children": [
        {
          "match": "Mozilla/5.0 (#PLATFORM# Trident/7.* IEMobile/*) like Gecko (compatible; adidxbot/2.0*",
          "engine": "Trident_7",
          "device": "general Mobile Device",
          "platforms": [
            "WinPhone8.1",
            "WinPhone"
          ],
          "properties": {
            "Version": "2.0"
          }
        },
        {
          "match": "Mozilla/5.0 (#DEVICE##PLATFORM#) applewebkit* (*khtml*like*gecko*) Version/* Mobile/* Safari/* (compatible; adidxbot/2.0*",
          "engine": "WebKit",
          "devices": {
            "iPhone": "iPhone",
            "iPad": "iPad",
            "iPod": "iPod Touch"
          },
          "platforms": [
            "iOS_A_7_0",
            "iOS_A"
          ],
          "properties": {
            "Version": "2.0"
          }
        },
        {
          "match": "Mozilla/5.0 (compatible; adidxbot/2.0; ?http://www.bing.com/bingbot.htm)",
          "properties": {
            "Version": "2.0"
          }
        },
        {
          "match": "adidxbot/1.1 (?http://search.msn.com/msnbot.htm)",
          "properties": {
            "Version": "1.1"
          }
        },
        {
          "match": "adidxbot/2.0*",
          "properties": {
            "Version": "2.0"
          }
        },
        {
          "match": "Mozilla/5.0 (compatible; adidxbot/*; ?http://www.bing.com/bingbot.htm)"
        },
        {
          "match": "adidxbot/*"
        }
      ]
    }
  ]
}
