{
  "division": "Kazehakase #MAJORVER#.#MINORVER#",
  "versions": ["0.5", "0.4"],
  "sortIndex": 2460,
  "lite": false,
  "standard": true,
  "userAgents": [
    {
      "userAgent": "Kazehakase #MAJORVER#.#MINORVER#",
      "platform": "Linux",
      "engine": "Gecko",
      "device": "Linux Desktop",
      "properties": {
        "Parent": "DefaultProperties",
        "Comment": "Kazehakase #MAJORVER#.#MINORVER#",
        "Browser": "Kazehakase",
        "Browser_Type": "Browser",
        "Version": "#MAJORVER#.#MINORVER#",
        "MajorVer": "#MAJORVER#",
        "MinorVer": "#MINORVER#",
        "Win32": "false",
        "Frames": "true",
        "IFrames": "true",
        "Tables": "true",
        "Cookies": "true",
        "JavaScript": "true"
      },
      "children": [
        {
          "match": "Mozilla\/5.0 (#PLATFORM#) Gecko* Firefox* Kazehakase\/#MAJORVER#.#MINORVER#*",
          "platforms": [
            "Linux_64", "Linux_32", "Linux"
          ]
        },
        {
          "match": "Mozilla\/5.0 (#PLATFORM#) Gecko* Kazehakase\/#MAJORVER#.#MINORVER#*",
          "platforms": [
            "Linux_64", "Linux_32", "Linux"
          ]
        },
        {
          "match": "Mozilla\/5.0 (#PLATFORM#) Gecko* Firefox* Kazehakase\/#MAJORVER#.#MINORVER#*",
          "device": "general Desktop",
          "platforms": [
            "FreeBSD"
          ]
        },
        {
          "match": "Mozilla\/5.0 (#PLATFORM#) Gecko* Kazehakase\/#MAJORVER#.#MINORVER#*",
          "device": "general Desktop",
          "platforms": [
            "FreeBSD"
          ]
        }
      ]
    }
  ]
}
