{
  "division": "Waterfox #MAJORVER#.#MINORVER#",
  "versions": ["50.1", 50, 49, 48, 47, 46, 45, 44, 43, 42, 41],
  "sortIndex": 3143,
  "lite": false,
  "standard": true,
  "userAgents": [
    {
      "userAgent": "Waterfox #MAJORVER#.#MINORVER#",
      "engine": "Gecko_Major_Dynamic",
      "device": "general Desktop",
      "properties": {
        "Parent": "DefaultProperties",
        "Comment": "Waterfox #MAJORVER#.#MINORVER#",
        "Browser": "Waterfox",
        "Browser_Type": "Browser",
        "Browser_Maker": "www.waterfoxproject.org",
        "Version": "#MAJORVER#.#MINORVER#"
      },
      "children": [
        {
          "match": "Mozilla/5.0 (#PLATFORM#) Gecko* Firefox/* Waterfox/#MAJORVER#.#MINORVER#*",
          "device": "Linux Desktop",
          "platforms": [
            "Linux_32_on_x64", "Linux_64", "Linux_32", "Linux"
          ]
        },
        {
          "match": "Mozilla/5.0 (#PLATFORM#) Gecko* Firefox/* Waterfox/#MAJORVER#.#MINORVER#*",
          "device": "Windows Desktop",
          "platforms": [
            "NT4_64", "NT4_x64",
            "Vista_32", "Vista_x64", "Vista_64",
            "Win7_x64_2", "Win7_x64", "Win7_64", "Win7_32",
            "Win8_x64", "Win8_64", "Win8_32",
            "Win8_1_x64", "Win8_1_64", "Win8_1_32",
            "Win10_x64", "Win10_64", "Win10_32", "Win10_x64_B", "Win10_64_B", "Win10_32_B",
            "Windows"
          ]
        },
        {
          "match": "Mozilla/5.0 (#PLATFORM#) Gecko* Firefox/* Waterfox/#MAJORVER#.#MINORVER#*",
          "device": "Macintosh",
          "platforms": [
            "OSX_10_12", "OSX_10_11", "OSX_10_10", "OSX_10_9", "OSX_10_8", "OSX_10_7", "OSX_10_6", "OSX_10_5",
            "OSX"
          ]
        }
      ]
    }
  ]
}
