{
  "division": "BlackBerry #MAJORVER#.#MINORVER#",
  "versions": ["10.3", "10.2", "10.1"],
  "sortIndex": 2360,
  "lite": false,
  "standard": true,
  "userAgents": [
    {
      "userAgent": "BlackBerry #MAJORVER#.#MINORVER#",
      "platform": "RIMOS_10_X",
      "engine": "WebKit",
      "device": "general Mobile Phone (Blackberry)",
      "properties": {
        "Parent": "DefaultProperties",
        "Comment": "BlackBerry #MAJORVER#.#MINORVER#",
        "Browser": "BlackBerry",
        "Browser_Type": "Browser",
        "Browser_Maker": "Research In Motion Limited",
        "Version": "#MAJORVER#.#MINORVER#"
      },
      "children": [
        {
          "match": "Mozilla/5.0 (BB10; #DEVICE#) applewebkit* (*khtml*like*gecko*) Version/#MAJORVER#.#MINORVER#*Safari/*",
          "devices": {
            "Kbd": "Blackberry KBD",
            "Touch": "Blackberry Z10"
          }
        },
        {
          "match": "Mozilla/5.0 (BB10; *) applewebkit* (*khtml*like*gecko*) Version/#MAJORVER#.#MINORVER#*Safari/*"
        }
      ]
    }
  ]
}
