{
  "division": "Copyright/Plagiarism",
  "sortIndex": 320,
  "lite": false,
  "standard": true,
  "userAgents": [
    {
      "userAgent": "Copyright/Plagiarism",
      "properties": {
        "Parent": "DefaultProperties",
        "Comment": "Copyright/Plagiarism",
        "Browser": "Copyright/Plagiarism",
        "Browser_Type": "Bot/Crawler",
        "Crawler": "true"
      },
      "children": [
        {
          "match": "BDFetch",
          "properties": {
            "Browser": "BDFetch"
          }
        },
        {
          "match": "copyright sheriff (*)",
          "properties": {
            "Browser": "copyright sheriff"
          }
        },
        {
          "match": "CopyRightCheck*",
          "properties": {
            "Browser": "CopyRightCheck"
          }
        },
        {
          "match": "FairAd Client*",
          "properties": {
            "Browser": "FairAd Client"
          }
        },
        {
          "match": "iCopyright Conductor*",
          "properties": {
            "Browser": "iCopyright Conductor"
          }
        },
        {
          "match": "IPiumBot laurion(dot)com",
          "properties": {
            "Browser": "IPiumBot"
          }
        },
        {
          "match": "IWAgent/*",
          "properties": {
            "Browser": "Brand Protect"
          }
        },
        {
          "match": "Mozilla/5.0 (compatible; DKIMRepBot/*)",
          "properties": {
            "Browser": "DKIMRepBot"
          }
        },
        {
          "match": "SlySearch/*",
          "properties": {
            "Browser": "SlySearch"
          }
        },
        {
          "match": "TutorGigBot/*",
          "properties": {
            "Browser": "TutorGig"
          }
        }
      ]
    }
  ]
}
