{
  "division": "SiteCon",
  "sortIndex": 491,
  "lite": false,
  "standard": true,
  "userAgents": [
    {
      "userAgent": "SiteCon",
      "platform": "Linux",
      "engine": "WebKit",
      "device": "Linux Desktop",
      "properties": {
        "Parent": "DefaultProperties",
        "Comment": "SiteCon",
        "Browser": "SiteCon",
        "Browser_Maker": "NCC Group.",
        "Browser_Type": "Application",
        "Crawler": "false"
      },
      "children": [
        {
          "match": "Mozilla/5.0 (#PLATFORM#) AppleWebKit/* (*khtml*like*gecko*) SiteCon/8.10*",
          "properties": {
            "Version": "8.10",
            "MajorVer": "8",
            "MinorVer": "10"
          },
          "platforms": [
            "Linux"
          ]
        },
        {
          "match": "Mozilla/5.0 (#PLATFORM#) AppleWebKit/* (*khtml*like*gecko*) SiteCon/8.8*",
          "properties": {
            "Version": "8.8",
            "MajorVer": "8",
            "MinorVer": "8"
          },
          "platforms": [
            "Linux"
          ]
        },
        {
          "match": "Mozilla/5.0 (#PLATFORM#) AppleWebKit/* (*khtml*like*gecko*) SiteCon/*",
          "platforms": [
            "Linux"
          ]
        }
      ]
    }
  ]
}
