{
  "division": "Galeon #MAJORVER#.#MINORVER#",
  "versions": [2, "1.3", "1.2", "1.1", 1],
  "sortIndex": 2380,
  "lite": false,
  "standard": true,
  "userAgents": [
    {
      "userAgent": "Galeon #MAJORVER#.#MINORVER#",
      "platform": "Linux",
      "device": "Linux Desktop",
      "engine": "Gecko",
      "properties": {
        "Parent": "DefaultProperties",
        "Comment": "Galeon #MAJORVER#.#MINORVER#",
        "Browser": "Galeon",
        "Browser_Type": "Browser",
        "Version": "#MAJORVER#.#MINORVER#",
        "MajorVer": "#MAJORVER#",
        "MinorVer": "#MINORVER#",
        "Frames": "true",
        "IFrames": "true",
        "Tables": "true",
        "Cookies": "true",
        "JavaScript": "true",
        "CssVersion": "2"
      },
      "children": [
        {
          "match": "Mozilla\/5.0 (#PLATFORM#) Gecko* Galeon\/#MAJORVER#.#MINORVER#* Firefox\/*",
          "platforms": [
            "Linux_32", "Linux"
          ]
        },
        {
          "match": "Mozilla\/5.0 (#PLATFORM#) Gecko* Galeon\/#MAJORVER#.#MINORVER#*",
          "platforms": [
            "Linux_32", "Linux"
          ]
        },
        {
          "match": "Mozilla\/5.0 (#PLATFORM#) Gecko* Galeon\/#MAJORVER#.#MINORVER#*",
          "device": "general Desktop",
          "platforms": [
            "FreeBSD"
          ]
        },
        {
          "match": "Mozilla\/5.0 Galeon\/#MAJORVER#.#MINORVER#* (#PLATFORM#)*",
          "platforms": [
            "Linux_32", "Linux"
          ]
        }
      ]
    }
  ]
}
