{
  "division": "Coc Coc Browser #MAJORVER#.#MINORVER# for Android",
  "versions": [64, 63, 62, 61, 60, 59, 58, 57, 56, 55, 54, 53, 52, 51, 50, 49, 48],
  "sortIndex": 883,
  "lite": false,
  "standard": true,
  "userAgents": [
    {
      "userAgent": "Coc Coc Browser #MAJORVER#.#MINORVER# for Android",
      "platform": "Android",
      "engine": "Blink",
      "device": "general Mobile Device (Touch)",
      "properties": {
        "Parent": "DefaultProperties",
        "Comment": "Coc Coc Browser #MAJORVER#.#MINORVER#",
        "Browser": "Coc Coc Browser",
        "Browser_Type": "Browser",
        "Browser_Maker": "Coc Coc Company Limited",
        "Version": "#MAJORVER#.#MINORVER#"
      },
      "children": [
        {
          "match": "Mozilla/5.0 (#PLATFORM##DEVICE# Build/*) applewebkit* (*khtml*like*gecko*) coc_coc_browser/#MAJORVER#.* Chrome/* Safari/*",
          "devices": {
            "SM-G935F": "Samsung SM-G935F"
          },
          "platforms": [
            "Android_6_0"
          ]
        },
        {
          "match": "Mozilla/5.0 (#PLATFORM##DEVICE# Build/*) applewebkit* (*khtml*like*gecko*) coc_coc_browser/#MAJORVER#.* Chrome/* Safari/*",
          "devices": {
            "SM-J320H": "Samsung SM-J320H"
          },
          "platforms": [
            "Android_5_1"
          ]
        },
        {
          "match": "Mozilla/5.0 (#PLATFORM##DEVICE# Build/*) applewebkit* (*khtml*like*gecko*) coc_coc_browser/#MAJORVER#.* Chrome/* Safari/*",
          "devices": {
            "SM-A300H": "Samsung SM-A300H"
          },
          "platforms": [
            "Android_5_0"
          ]
        },
        {
          "match": "Mozilla/5.0 (#PLATFORM##DEVICE# Build/*) applewebkit* (*khtml*like*gecko*) coc_coc_browser/#MAJORVER#.* Chrome/* Safari/*",
          "devices": {
            "SM-G530H": "Samsung SM-G530H"
          },
          "platforms": [
            "Android_4_4"
          ]
        },
        {
          "match": "Mozilla/5.0 (#PLATFORM##DEVICE# Build/*) applewebkit* (*khtml*like*gecko*) coc_coc_browser/#MAJORVER#.* Chrome/* Safari/*",
          "devices": {
            "ASUS_T00I": "Asus T00I"
          },
          "platforms": [
            "Android_4_3"
          ]
        },
        {
          "match": "Mozilla/5.0 (#PLATFORM##DEVICE# Build/*) applewebkit* (*khtml*like*gecko*) coc_coc_browser/#MAJORVER#.* Chrome/* Safari/*",
          "devices": {
            "GT-S7580": "Samsung GT-S7580"
          },
          "platforms": [
            "Android_4_2"
          ]
        },
        {
          "match": "Mozilla/5.0 (#PLATFORM##DEVICE# Build/*) applewebkit* (*khtml*like*gecko*) coc_coc_browser/#MAJORVER#.* Chrome/* Safari/*",
          "devices": {
            "GT-I9300": "Samsung GT-I9300"
          },
          "platforms": [
            "Android_4_1"
          ]
        },
        {
          "match": "Mozilla/5.0 (#PLATFORM#) applewebkit* (*khtml*like*gecko*) coc_coc_browser/#MAJORVER#.* Chrome/* Safari/*",
          "platforms": [
            "Android_7_1", "Android_7_0",
            "Android_6_0",
            "Android_5_1", "Android_5_0",
            "Android_4_4", "Android_4_3", "Android_4_2", "Android_4_1",
            "Android"
          ]
        }
      ]
    }
  ]
}
