{
  "division": "Relax Melodies",
  "sortIndex": 1991,
  "lite": false,
  "standard": true,
  "userAgents": [
    {
      "userAgent": "Relax Melodies",
      "browser": "relax melodies app",
      "engine": "WebKit",
      "device": "general Mobile Phone (Apple)",
      "properties": {
        "Parent": "DefaultProperties",
        "Comment": "Relax Melodies"
      },
      "children": [
        {
          "match": "Mozilla/5.0 (#DEVICE##PLATFORM#) applewebkit* (*khtml*like*gecko*) Mobile* IpnosInAppBrowser RelaxMelodies",
          "devices": {
            "iPhone": "iPhone"
          },
          "platforms": [
            "iOS_A_11_3", "iOS_A_11_2", "iOS_A_11_1", "iOS_A_11_0",
            "iOS_A_10_3", "iOS_A_10_2", "iOS_A_10_1", "iOS_A_10_0",
            "iOS_A_9_3", "iOS_A_9_2", "iOS_A_9_1", "iOS_A_9_0",
            "iOS_A_8_4", "iOS_A_8_3", "iOS_A_8_2", "iOS_A_8_1", "iOS_A_8_0", "iOS_A_8_0_B",
            "iOS_A_7_1", "iOS_A_7_0",
            "iOS_A"
          ]
        },
        {
          "match": "Mozilla/5.0 (#DEVICE##PLATFORM#) applewebkit* (*khtml*like*gecko*) Mobile* IpnosInAppBrowser RelaxMelodies",
          "devices": {
            "iPad": "iPad"
          },
          "platforms": [
            "iOS_C_11_3", "iOS_C_11_2", "iOS_C_11_1", "iOS_C_11_0",
            "iOS_C_10_3", "iOS_C_10_2", "iOS_C_10_1", "iOS_C_10_0",
            "iOS_C_9_3", "iOS_C_9_2", "iOS_C_9_1", "iOS_C_9_0",
            "iOS_C_8_4", "iOS_C_8_3", "iOS_C_8_2", "iOS_C_8_1", "iOS_C_8_0",
            "iOS_C_7_1", "iOS_C_7_0",
            "iOS_C"
          ]
        },
        {
          "match": "Mozilla/5.0 (#PLATFORM#) applewebkit* (*khtml*like*gecko*) Mobile* IpnosInAppBrowser RelaxMelodies",
          "platforms": [
            "iOS_A",
            "iOS_C"
          ]
        }
      ]
    }
  ]
}
