{
  "division": "Android WebView #MAJORVER#.#MINORVER#",
  "versions": [5, "4.4", "4.3", "4.2", "4.1"],
  "sortIndex": 953,
  "lite": true,
  "standard": true,
  "userAgents": [
    {
      "userAgent": "Android WebView #MAJORVER#.#MINORVER#",
      "platform": "Android",
      "engine": "Blink",
      "device": "general Mobile Phone (Touch)",
      "properties": {
        "Parent": "DefaultProperties",
        "Comment": "Android WebView #MAJORVER#.#MINORVER#",
        "Browser": "Android WebView",
        "Browser_Type": "Browser",
        "Browser_Maker": "Google Inc",
        "Version": "#MAJORVER#.#MINORVER#"
      },
      "children": [
        {
          "match": "Mozilla/5.0 (#PLATFORM##DEVICE# Build/*)*applewebkit*(*khtml*like*gecko*)*Version/#MAJORVER#.#MINORVER#*Chrome*Safari*",
          "devices": {
            "Micromax P480": "Micromax P480"
          },
          "platforms": [
            "Android_5_0"
          ]
        },
        {
          "match": "Mozilla/5.0 (#PLATFORM##DEVICE# Build/*)*applewebkit*(*khtml*like*gecko*)*Version/#MAJORVER#.#MINORVER#*Chrome*Safari*",
          "devices": {
            "itel it1407": "Itel IT1407",
            "Lenovo TAB S8-50F": "Lenovo S8-50F",
            "Lenovo TAB S8-50L": "Lenovo S8-50L",
            "LG-D415": "LG D415",
            "LG-D800*": "LG D800",
            "LG-D802*": "LG D802",
            "LG-F320K*": "LG F320K",
            "LG-F320L": "LG F320L",
            "LG-F320S": "LG F320S",
            "LGL31L*": "LG L31L",
            "LGL34C*": "LG L34C"
          },
          "platforms": [
            "Android_4_4"
          ]
        },
        {
          "match": "Mozilla/5.0 (#PLATFORM#)*applewebkit*(*khtml*like*gecko*)*Version/#MAJORVER#.#MINORVER#*Chrome*Safari*",
          "platforms": [
            "Android_7_1", "Android_7_0",
            "Android_6_0",
            "Android_5_1", "Android_5_0",
            "Android_4_4", "Android_4_3", "Android_4_2", "Android_4_1", "Android_4_0",
            "Android"
          ]
        },
        {
          "match": "Mozilla/5.0 (#PLATFORM#)*applewebkit*(*khtml*like*gecko*)*Version/#MAJORVER#.#MINORVER#*Safari*Chrome*",
          "platforms": [
            "Android_7_1", "Android_7_0",
            "Android_6_0",
            "Android_5_1", "Android_5_0",
            "Android_4_4", "Android_4_3", "Android_4_2", "Android_4_1", "Android_4_0",
            "Android"
          ]
        }
      ]
    }
  ]
}
