{
  "division": "LinkChecker",
  "sortIndex": 670,
  "lite": false,
  "standard": true,
  "userAgents": [
    {
      "userAgent": "LinkChecker",
      "properties": {
        "Parent": "DefaultProperties",
        "Comment": "Link Checkers",
        "Browser_Type": "Bot/Crawler",
        "Crawler": "true",
        "Browser": "LinkChecker"
      },
      "children": [
        {
          "match": "LinkChecker/7.*",
          "properties": {
            "Version": "7.0",
            "MajorVer": "7"
          }
        },
        {
          "match": "LinkChecker/*"
        }
      ]
    }
  ]
}
